<QUANAN xmlns="http://example.com/quanan"
        xmlns:xsi="http://www.w3.org/2001/XMLSchema-instance"
        xsi:schemaLocation="http://example.com/quanan quanan.xsd">

    <!-- Danh sách bàn -->
    <BAN>
        <MABAN>001</MABAN>
        <TENBAN>Bàn 1</TENBAN>
    </BAN>
    <BAN>
        <MABAN>002</MABAN>
        <TENBAN>Bàn 2</TENBAN>
    </BAN>
    <BAN>
        <MABAN>003</MABAN>
        <TENBAN>Bàn 3</TENBAN>
    </BAN>
    <BAN>
        <MABAN>004</MABAN>
        <TENBAN>Bàn 4</TENBAN>
    </BAN>
    <BAN>
        <MABAN>005</MABAN>
        <TENBAN>Bàn VIP</TENBAN>
    </BAN>

    <!-- Danh sách nhân viên -->
    <NHANVIEN>
        <MANV>NV01</MANV>
        <TENNV>Nguyen Van A</TENNV>
        <SDT>0901234567</SDT>
        <DIACHI>Ha Noi</DIACHI>
        <GIOITINH>Nam</GIOITINH>
        <USERNAME>nguyenvana</USERNAME>
        <PASSWORD>password1234</PASSWORD>
    </NHANVIEN>
    <NHANVIEN>
        <MANV>NV02</MANV>
        <TENNV>Tran Thi B</TENNV>
        <SDT>0912345678</SDT>
        <DIACHI>Hai Phong</DIACHI>
        <GIOITINH>Nu</GIOITINH>
        <USERNAME>tranthib</USERNAME>
        <PASSWORD>matkhau12345</PASSWORD>
    </NHANVIEN>
    <NHANVIEN>
        <MANV>NV03</MANV>
        <TENNV>Le Van C</TENNV>
        <SDT>0987654321</SDT>
        <DIACHI>Da Nang</DIACHI>
        <GIOITINH>Nam</GIOITINH>
        <USERNAME>levanc</USERNAME>
        <PASSWORD>abc1234567</PASSWORD>
    </NHANVIEN>
    <NHANVIEN>
        <MANV>NV04</MANV>
        <TENNV>Pham Thi D</TENNV>
        <SDT>0976543210</SDT>
        <DIACHI>Hue</DIACHI>
        <GIOITINH>Nu</GIOITINH>
        <USERNAME>phamthid</USERNAME>
        <PASSWORD>securepass123</PASSWORD>
    </NHANVIEN>
    <NHANVIEN>
        <MANV>NV05</MANV>
        <TENNV>Do Van E</TENNV>
        <SDT>0965432109</SDT>
        <DIACHI>HCM</DIACHI>
        <GIOITINH>Nam</GIOITINH>
        <USERNAME>dovane</USERNAME>
        <PASSWORD>mypassword123</PASSWORD>
    </NHANVIEN>

    <!-- Danh sách món -->
    <MON>
        <MAMON>M01</MAMON>
        <TENMON>Phở bò</TENMON>
        <GIA>45000</GIA>
        <HINHANH>pho.jpg</HINHANH>
    </MON>
    <MON>
        <MAMON>M02</MAMON>
        <TENMON>Bún chả</TENMON>
        <GIA>40000</GIA>
        <HINHANH>buncha.jpg</HINHANH>
    </MON>
    <MON>
        <MAMON>M03</MAMON>
        <TENMON>Bánh mì</TENMON>
        <GIA>20000</GIA>
        <HINHANH>banhmi.jpg</HINHANH>
    </MON>
    <MON>
        <MAMON>M04</MAMON>
        <TENMON>Cơm gà</TENMON>
        <GIA>50000</GIA>
        <HINHANH>comga.jpg</HINHANH>
    </MON>
    <MON>
        <MAMON>M05</MAMON>
        <TENMON>Lẩu thái</TENMON>
        <GIA>150000</GIA>
        <HINHANH>lauthai.jpg</HINHANH>
    </MON>

    <!-- Danh sách hóa đơn -->
    <HOADON>
        <SOHD>001</SOHD>
        <NGAYLAP>2025-09-30</NGAYLAP>
        <TONGTIEN>89000</TONGTIEN>
        <MABAN>001</MABAN> <!-- FK -->
        <MANV>NV01</MANV>   <!-- FK -->
    </HOADON>
    <HOADON>
        <SOHD>002</SOHD>
        <NGAYLAP>2025-09-30</NGAYLAP>
        <TONGTIEN>150000</TONGTIEN>
        <MABAN>002</MABAN>
        <MANV>NV02</MANV>
    </HOADON>
    <HOADON>
        <SOHD>003</SOHD>
        <NGAYLAP>2025-09-30</NGAYLAP>
        <TONGTIEN>20000</TONGTIEN>
        <MABAN>003</MABAN>
        <MANV>NV03</MANV>
    </HOADON>
    <HOADON>
        <SOHD>004</SOHD>
        <NGAYLAP>2025-09-30</NGAYLAP>
        <TONGTIEN>50000</TONGTIEN>
        <MABAN>004</MABAN>
        <MANV>NV04</MANV>
    </HOADON>
    <HOADON>
        <SOHD>005</SOHD>
        <NGAYLAP>2025-09-30</NGAYLAP>
        <TONGTIEN>150000</TONGTIEN>
        <MABAN>005</MABAN>
        <MANV>NV05</MANV>
    </HOADON>

    <!-- Danh sách chi tiết hóa đơn -->
    <CHITIETHOADON>
        <SOHD>001</SOHD> <!-- FK -->
        <MAMON>M01</MAMON> <!-- FK -->
        <SOLUONG>2</SOLUONG>
    </CHITIETHOADON>
    <CHITIETHOADON>
        <SOHD>002</SOHD>
        <MAMON>M05</MAMON>
        <SOLUONG>1</SOLUONG>
    </CHITIETHOADON>
    <CHITIETHOADON>
        <SOHD>003</SOHD>
        <MAMON>M03</MAMON>
        <SOLUONG>1</SOLUONG>
    </CHITIETHOADON>
    <CHITIETHOADON>
        <SOHD>004</SOHD>
        <MAMON>M04</MAMON>
        <SOLUONG>1</SOLUONG>
    </CHITIETHOADON>
    <CHITIETHOADON>
        <SOHD>005</SOHD>
        <MAMON>M02</MAMON>
        <SOLUONG>3</SOLUONG>
    </CHITIETHOADON>

</QUANAN>
